"Name","Description","GitHub","Stars","Watchers","Forks","DOI","Journal","Year","Altmetrics","ImpactFactor"
"samtools","Tools (written in C using htslib) for manipulating next-generation sequencing data","https://github.com/samtools/samtools",657,110,353,"10.1093/bioinformatics/btp352","Bioinformatics","2009","72.53",5.481
"bwa","Burrow-Wheeler Aligner for short-read alignment (see minimap2 for long-read alignment)","https://github.com/lh3/bwa",584,116,319,"10.1093/bioinformatics/btp324","Bioinformatics","2009","43.858",5.481
"STAR","RNA-seq aligner","https://github.com/alexdobin/STAR",548,86,192,"10.1093/bioinformatics/bts635","Bioinformatics","2012","92.99",5.481
"trinityrnaseq","Trinity RNA-Seq de novo transcriptome assembly","https://github.com/trinityrnaseq/trinityrnaseq",297,61,186,"10.1038/nbt.1883","Nature Biotechnology","2011","40.696",35.724
"seurat","R toolkit for single cell genomics","https://github.com/satijalab/seurat",262,51,177,"10.1038/nbt.4096","Nature Biotechnology","2018","317.74",35.724
"MACS","MACS -- Model-based Analysis of ChIP-Seq","https://github.com/taoliu/MACS",252,52,159,"10.1186/gb-2008-9-9-r137","Genome Biology","2008","15",13.214
"canu","A single molecule sequence assembler for genomes large and small.","https://github.com/marbl/canu",240,46,75,"10.1101/gr.215087.116","Genome Research","2017","87.65",10.101
"gemini","a lightweight db framework for exploring genetic variation.","https://github.com/arq5x/gemini",233,46,105,"10.1371/journal.pcbi.1003153","PLoS Computational Biology","2013","39.334",3.955
"bowtie2","A fast and sensitive gapped read aligner","https://github.com/BenLangmead/bowtie2",189,29,68,"10.1038/nmeth.1923","Nature Methods","2012","76.838",26.919
"vcftools","A set of tools written in Perl and C++ for working with VCF files, such as those generated by the 1000 Genomes Project. ","https://github.com/vcftools/vcftools",189,26,83,"10.1093/bioinformatics/btr330","Bioinformatics","2011","30.08",5.481
"velvet","Short read de novo assembler using de Bruijn graphs","https://github.com/dzerbino/velvet",176,22,74,"10.1371/journal.pone.0008407","PLoS ONE","2009","6.5",2.766
"cufflinks","","https://github.com/cole-trapnell-lab/cufflinks",172,41,92,"10.1038/nbt.1621","Nature Biotechnology","2010","44.434",35.724
"hisat2","Graph-based alignment (Hierarchical Graph FM index)","https://github.com/infphilo/hisat2",171,41,57,"10.1038/nmeth.3317","Nature Methods","2015","50.316",26.919
"bcftools","This is the official development repository for BCFtools. To compile, the develop branch of htslib is needed: git clone --branch=develop git://github.com/samtools/htslib.git htslib","https://github.com/samtools/bcftools",171,52,111,"10.1093/bioinformatics/btw044","Bioinformatics","2016","8.75",5.481
"vcfanno","annotate a VCF with other VCFs/BEDs/tabixed files ","https://github.com/brentp/vcfanno",159,22,27,"10.1186/s13059-016-0973-5","Genome Biology","2015","8.05",13.214
"giggle","Interval data structure","https://github.com/ryanlayer/giggle",153,19,19,"10.1038/nmeth.4556","Nature Methods","2018","102.95",26.919
"lumpy-sv","lumpy: a general probabilistic framework for structural variant discovery","https://github.com/arq5x/lumpy-sv",149,26,71,"10.1186/gb-2014-15-6-r84","Genome Biology","2014","42.15",13.214
"abyss",":microscope: Assemble large genomes using short reads","https://github.com/bcgsc/abyss",140,26,64,"10.1093/bioinformatics/btp367","Bioinformatics","2009","3",5.481
"mothur","Welcome to the mothur project, initiated by Dr. Patrick Schloss and his software development team in the Department of Microbiology & Immunology at The University of Michigan. This project seeks to develop a single piece of open-source, expandable software to fill the bioinformatics needs of the microbial ecology community.","https://github.com/mothur/mothur",137,33,68,"10.1128/aem.01541-09","Applied & Environmental Microbiology","2009","23.5",3.633
"delly","DELLY2: Structural variant discovery by integrated paired-end and split-read analysis","https://github.com/dellytools/delly",125,32,55,"10.1093/bioinformatics/bts378","Bioinformatics","2012","23.5",5.481
"qiime2","Official repository for the QIIME 2 framework.","https://github.com/qiime2/qiime2",113,34,74,"10.1038/nmeth.f.303","Nature Methods","2010","44.208",26.919
"mummer","Mummer alignment tool","https://github.com/mummer4/mummer",111,20,32,"10.1371/journal.pcbi.1005944","PLoS Computational Biology","2018","106.85",3.955
"monocle-release","","https://github.com/cole-trapnell-lab/monocle-release",103,30,50,"10.1038/nbt.2859","Nature Biotechnology","2014","79.646",35.724
"clinvar","This repo provides tools to convert ClinVar data into a tab-delimited flat file, and also provides that resulting tab-delimited flat file.","https://github.com/macarthur-lab/clinvar",95,41,41,"10.1093/nar/gkx1153","Nucleic Acids Research","2017","13.53",11.561
"HiC-Pro","HiC-Pro: An optimized and flexible pipeline for Hi-C data processing","https://github.com/nservant/HiC-Pro",94,23,64,"10.1186/s13059-015-0831-x","Genome Biology","2014","11.05",13.214
"ballgown","Bioconductor package ""ballgown"", devel version. Isoform-level differential expression analysis in R.","https://github.com/alyssafrazee/ballgown",93,23,50,"10.1038/nbt.3172","Nature Biotechnology","2015","48.008",35.724
"stringtie","Transcript assembly and quantification for RNA-Seq","https://github.com/gpertea/stringtie",83,19,25,"10.1038/nprot.2016.095","Nature Protocols","2016","81.046",12.423
"scLVM","scLVM is a modelling framework for single-cell RNA-seq data that can be used to dissect the observed heterogeneity into different sources, thereby allowing for the correction of confounding sources of variation.","https://github.com/PMBio/scLVM",82,23,39,"10.1038/nbt.3102","Nature Biotechnology","2015","174.716",35.724
"CNVnator","a tool for CNV discovery and genotyping from depth-of-coverage by mapped reads","https://github.com/abyzovlab/CNVnator",71,11,28,"10.1101/gr.114876.110","Genome Research","2011","27.836",10.101
"SIMLR","Implementations both in R and Matlab of SIMLR (https://www.nature.com/articles/nmeth.4207) and CIMLR (https://www.biorxiv.org/content/early/2018/02/16/267245) Multi-kernel LeaRning methods. ","https://github.com/BatzoglouLabSU/SIMLR",63,18,35,"10.1038/nmeth.4207","Nature Methods","2017","47.95",26.919
"SnpEff","","https://github.com/pcingola/SnpEff",63,23,39,"10.4161/fly.19695","Fly","2014","9.5",1.218
"sciclone","An R package for inferring the subclonal architecture of tumors","https://github.com/genome/sciclone",60,48,33,"10.1371/journal.pcbi.1003665","PLoS Computational Biology","2014","32.612",3.955
"ZIFA","Zero-inflated dimensionality reduction algorithm for single-cell data","https://github.com/epierson9/ZIFA",59,8,22,"10.1186/s13059-015-0805-z","Genome Biology","2014","41.926",13.214
"MAST","Tools and methods for analysis of single cell assay data in R","https://github.com/RGLab/MAST",57,9,26,"10.1186/s13059-015-0844-5","Genome Biology","2014","39.906",13.214
"clonevol","Inferring and visualizing clonal evolution in multi-sample cancer sequencing","https://github.com/hdng/clonevol",55,8,24,"10.1093/annonc/mdx517","Annals of Oncology","2017","15.65",13.926
"clonevol","Inferring and visualizing clonal evolution in multi-sample cancer sequencing","https://github.com/hdng/clonevol",55,8,24,"10.1093/annonc/mdx517","Annals of Oncology","2017","15.65",13.926
"clonevol","Inferring and visualizing clonal evolution in multi-sample cancer sequencing","https://github.com/hdng/clonevol",55,8,24,"10.1093/annonc/mdx517","Annals of Oncology","2017","15.65",13.926
"clonevol","Inferring and visualizing clonal evolution in multi-sample cancer sequencing","https://github.com/hdng/clonevol",55,8,24,"10.1093/annonc/mdx517","Annals of Oncology","2017","15.65",13.926
"htseq","HTSeq is a Python library to facilitate processing and analysis of data from  high-throughput sequencing (HTS) experiments.","https://github.com/simon-anders/htseq",54,9,34,"10.1093/bioinformatics/btu638","Bioinformatics","2014","55.346",5.481
"circlator","A tool to circularize genome assemblies","https://github.com/sanger-pathogens/circlator",53,16,18,"10.1186/s13059-015-0849-0","Genome Biology","2014","51.208",13.214
"Artemis","Artemis is a free genome viewer and annotation tool that allows visualization of sequence features and the results of analyses within the context of the sequence, and its six-frame translation","https://github.com/sanger-pathogens/Artemis",52,12,29,"10.1093/bioinformatics/btr703","Bioinformatics","2011","26.334",5.481
"svtyper","Bayesian genotyper for structural variants","https://github.com/hall-lab/svtyper",52,10,24,"10.1038/nmeth.3505","Nature Methods","2015","155.138",26.919
"TADbit","TADbit is a complete Python library to deal with all steps to analyze, model and explore 3C-based data. With TADbit the user can map FASTQ files to obtain raw interaction binned matrices (Hi-C like matrices), normalize and correct interaction matrices, identify and compare the so-called Topologically Associating Domains (TADs), build 3D models from the interaction matrices, and finally, extract structural properties from the models. TADbit is complemented by TADkit for visualizing 3D models","https://github.com/3DGenomes/TADbit",51,15,47,"10.1371/journal.pcbi.1005665","PLoS Computational Biology","2017","19.25",3.955
"PhenoGraph","Subpopulation detection in high-dimensional single-cell data","https://github.com/jacoblevine/PhenoGraph",51,7,26,"10.1016/j.cell.2015.05.047","Cell","2015","32.588",31.398
"methylKit","R package for DNA methylation analysis","https://github.com/al2na/methylKit",51,15,61,"10.1186/gb-2012-13-10-r87","Genome Biology","2012","23.6",13.214
"weblogo","WebLogo 3: Sequence Logos redrawn","https://github.com/WebLogo/weblogo",50,10,20,"10.1101/gr.849004","Genome Research","2004","9.5",10.101
"GenomicDataCommons","Provide R access to the NCI Genomic Data Commons portal.","https://github.com/Bioconductor/GenomicDataCommons",44,17,16,"10.1158/0008-5472.can-17-0598","Cancer Research","2017","7.35",9.13
"HiCExplorer","HiCExplorer is a powerful and easy to use set of tools to process, normalize and visualize Hi-C data.","https://github.com/deeptools/HiCExplorer",40,13,20,"10.1093/nar/gky504","Nucleic Acids Research","2018","31.35",11.561
"pagoda2","R package for analyzing and interactively exploring large single-cell RNA-seq datasets","https://github.com/hms-dbmi/pagoda2",39,17,8,"10.1038/nmeth.2967","Nature Methods","2014","21.6",26.919
"SV2","Support Vector Structural Variation Genotyper","https://github.com/dantaki/SV2",39,5,5,"10.1093/bioinformatics/btx813","Bioinformatics","2017","7.75",5.481
"CIDR","Clustering through Imputation and Dimensionality Reduction","https://github.com/VCCRI/CIDR",36,9,10,"10.1186/s13059-017-1188-0","Genome Biology","2017","13.8",13.214
"Damage-estimator","Estimate damage in standard NGS library preparation. Incompatible with library preparation methods from which the imbalance is lost (such as transposon based methods and Ultra II FS library preparation from NEB). ","https://github.com/Ettwiller/Damage-estimator",36,6,8,"10.1126/science.aai8690","Science","2017","807.358",41.058
"SCENIC","SCENIC is an R package to infer Gene Regulatory Networks and cell types from single-cell RNA-seq data.","https://github.com/aertslab/SCENIC",35,12,16,"10.1038/nmeth.4463","Nature Methods","2017","61.46",26.919
"DESeq2","Differential gene expression analysis based on the negative binomial distribution","https://github.com/mikelove/DESeq2",34,7,9,"10.1186/s13059-014-0550-8","Genome Biology","2014","44.354",13.214
"Juicebox","Visualization and analysis software for Hi-C data - ","https://github.com/theaidenlab/Juicebox",34,21,13,"10.1016/j.cels.2016.07.002","Cell Systems","2016","544.65",8.982
"BISCUIT_SingleCell_IMM_ICML_2016","R Codebase for BISCUIT: Infinite Mixture Model to cluster and impute single cells.","https://github.com/sandhya212/BISCUIT_SingleCell_IMM_ICML_2016",30,15,13,"10.1016/j.cell.2018.05.060","Cell","2018","233.05",31.398
"scDD","R package to identify genes with differential distributions in single-cell RNA-seq","https://github.com/kdkorthauer/scDD",24,4,8,"10.1186/s13059-016-1077-y","Genome Biology","2016","32.596",13.214
"2020plus","Classifies genes as an oncogene, tumor suppressor gene, or as a non-driver gene by using Random Forests","https://github.com/KarchinLab/2020plus",21,12,14,"10.1073/pnas.1616440113","Proceedings of the National Academy of Sciences of the United States of America","2016","75.67",9.504
"tree-hmm","Tree hidden Markov model for learning epigenetic states in multiple cell types","https://github.com/uci-cbcl/tree-hmm",18,6,8,"10.1186/1471-2105-14-s5-s4","BMC Bioinformatics","2013","1.5",2.213
"hic-bench","A set of pipelines for Hi-C and ChIP-Seq analysis.","https://github.com/NYU-BFX/hic-bench",14,11,9,"10.1186/s12864-016-3387-6","BMC Genomics","2017","4.6",3.73
"SPRING_dev","","https://github.com/AllonKleinLab/SPRING_dev",13,5,5,"10.1093/bioinformatics/btx792","Bioinformatics","2017","1.5",5.481
"seqc","Single-Cell Sequencing Quality Control and Processing Software","https://github.com/ambrosejcarr/seqc",13,17,3,"10.1016/j.cell.2018.05.060","Cell","2018","233.05",31.398
